question,contexts,answer,ground_truth,answer_correctness,faithfulness,answer_relevancy,context_precision
"What is the significance of cherry trees in Washington, D.C.?","[""the eagerly awaited D.C. blossoms: . The city's first cherry trees were destroyed . In 1910, 2,000 cherry trees arrived in Washington, thanks to a gift from the city of Tokyo and the advocacy of Eliza Ruhamah Scidmore, one of the first female board members of the National Geographic Society. These trees, however, were riddled with disease and were destroyed. Two years later, first lady Helen Herron Taft planted one of the first of more than 3,000 replacement trees sent from Japan. Winter's""
 'Herron Taft planted one of the first of more than 3,000 replacement trees sent from Japan. Winter\'s almost over: See the proof . The festival was launched more than 20 years later . It wasn\'t until 1935 that civic groups and the D.C. government came together to hold the first ""Cherry Blossom Festival."" That first official festival came after smaller commemorations including a three-day celebration in 1934 and a 1927 re-enactment of the original planting of the trees by a group of Washington'
 ""in 1934 and a 1927 re-enactment of the original planting of the trees by a group of Washington school children. It's not all about cherry trees . That's right, there's a Blossom Kite Festival right in the middle of the cherry blossom festivities on March 28th. The festival consists of a hot tricks showdown, learning how to make and fly kites, and there's even a kite doctor on site to repair broken kites. Two types of trees dominate . In the 1912 gift of trees to Washington, there were 12""
 ""Washington (CNN)There should be plenty of pent-up anticipation among cherry blossom fans in Washington this spring. Peak blooms are expected at the tail end of the three-week-long National Cherry Blossom Festival, which kicks off Friday and runs through April 12. The fluttering pink and white blossoms are expected to hit their peak between April 11 and April 14. Here are five things to know about the eagerly awaited D.C. blossoms: . The city's first cherry trees were destroyed . In 1910, 2,000""
 ""broken kites. Two types of trees dominate . In the 1912 gift of trees to Washington, there were 12 different varieties. Today, two varieties are dominant -- Yoshino and Kwanzan. Kwanzan trees are usually found in the East Potomac Park area and produce pink blossoms. The Yoshino, which produce white blossoms, are closer to the northern part of the Tidal Basin near the Washington Monument. Descendants of the original trees live in Japan . In 2011, about 120 trees propagated from D.C.'s surviving""]","The cherry trees in Washington, D.C., symbolize the enduring friendship between the United States and Japan, originating from a gift of 3,000 trees in 1912. They are central to the annual National Cherry Blossom Festival, which celebrates their blooming and attracts numerous visitors. The trees also represent historical and cultural connections, with descendants of the original trees still thriving in Japan.","Cherry trees hold great significance in Washington, D.C. as they are a symbol of the friendship between the United States and Japan. The gift of cherry trees from Japan to Washington, D.C. in 1912 has led to the annual National Cherry Blossom Festival, which attracts millions of visitors each year. The cherry blossoms also represent the arrival of spring and are a beautiful sight for locals and tourists alike.",0.6866336247590816,1.0,0.9644715242550327,0.99999999998
What is one of the events that Hillary Clinton will be participating in during the month of March that involves a paid appearance?,"[""(CNN)After a handful events in two months, Hillary Clinton has filled her March with a mix of women's events, nonprofit speeches and at least one paid appearance. In January and February, Clinton headlined three events -- only one of which was in the United States. But as Clinton moves closer to her expected 2016 presidential campaign announcement, the former secretary or state has at least seven events scheduled for the month of March. Most of Clinton's events are focused on one thing: women.""
 ""events scheduled for the month of March. Most of Clinton's events are focused on one thing: women. Clinton starts her month by headlining the 30th anniversary gala for Emily's List -- a pro-Clinton organization that focused on helping Democratic women win elected office. At the D.C. speech on March 3, Clinton is expected to give a nod to the group's importance to Democrats and highlight the reason more women are needed in politics. Emily's List has been energized by Clinton's campaign and has""
 'in the economy and politics. The following day -- on March 10 -- Clinton will headline the United Nation\'s Women Empowerment Principles annual gathering in New York. Clinton will use the speech to outline the findings in the Clinton Foundation report and ""reflect on progress made in implementing the agenda set in Beijing two decades ago,"" the organizers said in a release about the event. On March 16, Clinton will be inducted into the Irish America Hall of Fame at an event in New York. Clinton'
 'Camp Association, NY & NJ Conference. Susie Lupert, the group\'s executive director, tells CNN, ""Yes, just like most nonprofits and conferences, she is being paid for her appearance."" But she would not confirm how much she is being paid. On average, Clinton makes between $200,000 and $300,000 per speech. Near the end of the month, on March 23 in Washington, D.C., Clinton will be the keynote speaker at the award celebration for the Toner Prize for Excellence in Political Reporting from Syracuse'
 'in pitches to women. In that speech Clinton said, ""If there is one message that echoes forth from this conference, let it be that human rights are women\'s rights and women\'s rights are human rights once and for all."" On March 9, Clinton teams up with Chelsea, her daughter, and Melinda Gates to release a report through the Clinton Foundation that looks at ""the gaps that still remain"" in women\'s participation in the economy and politics. The following day -- on March 10 -- Clinton will headline']","Hillary Clinton will be participating in the NY & NJ Camp Association Conference, which involves a paid appearance.","Hillary Clinton will be participating in the American Camp Association, NY & NJ Conference in Atlantic City on March 19, which is a paid appearance.",0.7426429926750251,1.0,0.8997713632863725,0.99999999998
What role did the United States-led coalition play in the fight against ISIS according to King Abdullah II of Jordan?,"['past year and a half?"" Jordan has a ""responsibility to reach out to eastern Syria"" and to western Iraq where people have been ""executed in large numbers"" by ISIS, Abdullah insisted. ""So this is our war,"" he said. ""We have a moral responsibility to reach out to those Muslims to protect them and stop (ISIS) before they reach our border."" Zakaria asked Abdullah what he thinks about the perception some have that Syrian President Bashar al-Assad is interested in combating ISIS, meaning al-Assad and'
 ""more than a month, al-Kasasbeh's family, hailing from a high-ranking tribe considered especially loyal to Jordan's royal family, implored ISIS to let him go. Hope that he could be spared ended in early February when a video emerged showing the 29-year-old pilot in a cage, being burned alive. King Abdullah II, an instrumental supporter of the global coalition, then said Jordan would be relentless in retaliating against ISIS. The country unleashed airstrikes. To Zakaria, Abdullah reiterated his""
 'in retaliating against ISIS. The country unleashed airstrikes. To Zakaria, Abdullah reiterated his commitment to stop ISIS. He called its fighters ""outlaws"" who twist Islam and use ""intimidation"" as their biggest weapon. The King told Zakaria that he didn\'t watch the video of the pilot\'s slaying. ""I -- many of us refused to see what I think is propaganda,"" Abdullah said. He felt ""disgust, sadness for the family"" and his ""heart went out to the father, the mother, the brothers, the sisters,"" the'
 ""(CNN)In his first interview since Islamic State militants burned alive a Jordanian pilot, the King of Jordan spoke to CNN's Fareed Zakaria about why and how the country is going after the terror group. Last December, ISIS captured Royal Jordanian Air Force pilot Moath al-Kasasbeh after his plane went down during airstrikes that were part of the United States-led coalition to defeat the group. For more than a month, al-Kasasbeh's family, hailing from a high-ranking tribe considered especially""
 'to ISIS members as Islamic extremists because their actions are not Islamic. ""I think he is right,"" Abdullah said. ""This is something that has to be understood on a much larger platform. (ISIS) is looking for legitimacy (that) they have inside of Islam."" ""I\'m a Muslim,"" the King said. ""These people (ISIS members) ... are on the fringe of Islam."" ""The barbarity with the way they executed our brave hero (the pilot), I think, shocked the Muslim world, especially Jordanians and people from this'
 'saying that airstrikes have continued. ""There are continued operations going on in Syria. We are coordinating with our friends in Iraq."" He said there is a ""long-term approach"" to fighting ISIS but didn\'t give any more details. The war against ISIS is as much Jordan\'s war as that of any other country in the coalition, he said. ""It is our war. It has been for a long time,"" he said. ""These are outlaws, in a way, of Islam, the minute they set up this irresponsible caliphate to try to expand their'
 'try to intimidate Jordanians ... just (has) the reverse effect,"" Abdullah said. ""If you look at our history, we\'re a country that\'s used to being outgunned and outnumbered. We\'ve always punched way above our weight. I think, if anything, Daesh has us as a tiger by the tail."" The pilot\'s killing ""just motivated Jordanians to rally around the flag,"" he said. ""The gloves have come off."" ISIS is ""always trying to intimidate, scare, put fear in people\'s hearts,"" the King told Zakaria. ""They are']","According to King Abdullah II of Jordan, the United States-led coalition played a significant role in the fight against ISIS by conducting airstrikes, which included the mission during which Royal Jordanian Air Force pilot Moath al-Kasasbeh was captured. Jordan coordinated with coalition partners, including operations in Syria and Iraq, as part of a long-term approach to combat ISIS.",The United States-led coalition played a role in the fight against ISIS by conducting airstrikes in support of Jordan and other countries. King Abdullah II mentioned that Jordan coordinated with their friends in Iraq and that there is a long-term approach to fighting ISIS.,0.6900334310905829,0.6666666666666666,0.9999999999999997,0.9999999999857143
"What can viewers expect from the season finale of ""The Walking Dead""?","['(CNN)Have Rick and his fellow survivors finally found a place they can settle in for the long term? That was the question left still unanswered at the end of Sunday night\'s season finale of ""The Walking Dead,"" and a finale record 15.8 million viewers tuned in to find out the answer. Rick was back in ""Ricktatorship"" mode, telling the residents of Alexandria that he knew what it took to survive and they should follow him. That led up to one of many moments where we gasped during the 90-minute'
 '(CNN)They thought they had found a paradise. They thought wrong. The resolution of the Alexandria story arc is the first of six things you should watch this week. 1. ""The Walking Dead,"" 9 p.m. ET Sunday, AMC . ""The Walking Dead\'s"" season-long plotline involving a group that headed north from Atlanta all comes to a head in a 90-minute season finale on Sunday night. It\'s been a season in which Sonequa Martin-Green\'s character, Sasha, stood out: She\'s on the verge of insanity after the deaths of'
 'late summer with season two set for 2016. An official premiere date has not yet been announced. The season five finale of the flagship series airs Sunday at 9 p.m. Read more: How ""The Walking Dead"" stumbled in its storytelling this season . ©2015 The Hollywood Reporter. All rights reserved.'
 'The first season will consist of six hourlong episodes — just like the flagship series did. The drama will premiere on AMC in the ""late summer,"" with season two set for 2016. Robert Kirkman, who created The Walking Dead comic series, co-wrote the pilot with Dave Erickson (""Sons of Anarchy""). Kirkman and Erickson exec produce alongside ""Walking Dead\'s"" Gale Anne Hurd and Dave Alpert. Erickson serves as showrunner, while Adam Davidson directed the pilot. ""Walking Dead"" VFX guru Greg Nicotero will'
 ""and they should follow him. That led up to one of many moments where we gasped during the 90-minute finale. Here are five of the biggest gaspworthy moments: . 1. Morgan is back . We've literally been looking for him all season, and Rick's old friend Morgan -- going all the way back to the first episode -- made a return appearance, wielding a stick he used to kick walker, and human, butt when necessary. And it was definitely necessary once he was captured by two men wearing W's on their heads,""
 'rant in front of the leaders of the Alexandria community, his fate and that of his fellow survivors hangs in the balance. ""There\'s gonna be all the twists and turns you would expect and twists and turns you did not expect,"" Martin-Green said of the episode. ""The finale is probably the most jam-packed episode there\'s ever been. Things are packed into it like sardines. All of the life is squeezed in there. They lengthened it to 90 minutes because there\'s just so much. It\'s a supersized'
 ""them. We rarely believe what we hear when there are rumors that Daryl might die, but that was a close one. 3. Carol and her casserole . Melissa McBride continues to steal scenes left and right lately, and her threatening of Pete while lending him a casserole may be one of the best scenes in the series' history so far. 4. Glenn gets shot . We seriously thought Glenn was a goner after a vengeful Nicholas shot him, then left him for a large group of walkers to attack. Somehow, Glenn survived and""]","Viewers can expect a 90-minute, action-packed episode with numerous twists and turns. Key moments include the return of Morgan, Carol's intense confrontation with Pete, and Glenn's near-death experience. The episode is described as the most jam-packed of the series, with significant developments for the characters.","The season finale of ""The Walking Dead"" is expected to be a jam-packed episode filled with twists and turns. It has been extended to 90 minutes due to the amount of content packed into it. Viewers can expect a supersized monstrosity of an episode that will go down as one of the best in the show's history.",0.5924843216667883,1.0,0.9336378807061892,0.7961904761745524
What is the significance of the Tunisian jihadist in relation to the terrorist attack at the Bardo Museum?,"['the prestigious Bardo Museum in central Tunis, the country\'s tourism industry is once again facing jeopardy even as authorities and operators scramble to ensure the safety of visitors currently in the country. A significant number of foreign tourists were inside the museum at the time of the attack, which government officials said was the work of ""Islamists."" Prime Minister Habib Essid said Polish, Italian, German and Spanish tourists are among those killed, with another 20 tourists plus two'
 ""(CNN)Wednesday's terrorist attack, which killed 23 people, hit Tunisia where it hurt by targeting its flourishing tourism industry. The deadly attack on the prominent Bardo Museum near Tunisia's parliament in the country's capital, Tunis, is the latest instance of an armed assault carried out by gunmen willing to fight to the death, a tactic that has been widely adopted by jihadist terrorists in recent years, including in North Africa. Such attacks mimic the 2008 Mumbai assaults in which 10""
 'group. His post comes after an ISIS fighter in the extremist group\'s stronghold of Raqqa in Syria recently appeared in a video questioning why militants in Tunisia had not pledged fealty. ""This raises the possibility that the museum attack could be ISIS\' debut on the Tunisian stage, timed to precede a pledge of allegiance from Tunisian jihadis for maximum impact,"" CNN terrorism analyst Paul Cruickshank said. The attack may have been in and about Tunisia, but the vast majority of the victims'
 ""London (CNN)Tunisia's ultra-radical fringe has come back to bite a government born out of the most successful experiment in constitutional reform to emerge from the 2011 Arab Spring revolutions. Wednesday's attack on the Bardo Museum in Tunis was grimly predictable, coming from what the Tunisian Interior Ministry calls a violent ultra-radical Islamist fringe forced underground -- but not crushed -- by security services. Jihadist firebrands representing thousands of active militants at home and""
 'the Bardo Museum. Protesters held banners that said ""We are not afraid"" and ""Je suis Bardo"" as they chanted ""Tunisia is free, and out with terrorism."" On March 18, the art, culture and history museum was the site of a drastically different scene, as gunmen opened fire on tourists in a siege that also forced the evacuation of the neighboring Parliament. ISIS claimed responsibility for the attack in an audio message posted online the next day. Hours before Sunday\'s demonstration began, Tunisia\'s'
 ""(CNN)The attack on Tunisia's famed Bardo Museum is just the latest evidence that parts of North and sub-Saharan Africa have become a magnet for Islamist extremism. Tunisia -- lying just across the Mediterranean from Europe, but bordered on one side by Libya and on the other by Algeria -- has until now not suffered the kind of large-scale terror attacks seen in both those nations in recent years. But it has emerged as a place of increasing concern as the threat of Islamist extremism has""
 'This is a sobering finding for Tunisia, which had been largely immune from the kinds of terrorist attacks that have recently plagued Libya and other North African countries. While the museum attack in Tunisia and the hotel attack in Libya may help terrorist groups to achieve their strategic goals, more often than not, armed assaults by terrorists against so-called soft targets such as hotels, supermarkets and malls do not achieve much beyond the tactical successes of global news coverage and']","The significance of the Tunisian jihadist in relation to the terrorist attack at the Bardo Museum is that the attack may have been ISIS' debut in Tunisia, potentially timed to precede a pledge of allegiance from Tunisian jihadis for maximum impact. This suggests that the attack was not only aimed at harming Tunisia's tourism industry but also at establishing ISIS' presence and influence in the country.","The significance of the Tunisian jihadist in relation to the terrorist attack at the Bardo Museum is that he had tweeted about a pledge of allegiance to Abu Bakr al-Baghdadi, the leader of ISIS, which was coming soon. This suggests that the attack could be ISIS' debut in Tunisia and was timed to precede a pledge of allegiance from Tunisian jihadis for maximum impact.",0.6166302940970797,0.2,1.0000000000000007,0.9999999999857143
How did the undercover FBI informant play a role in the arrest of the Army National Guard member and his cousin for allegedly conspiring to provide material support to ISIS?,"[""(CNN)An Army National Guard member and his cousin have been arrested in Illinois for allegedly conspiring to provide material support to the terrorist organization ISIS, federal prosecutors said Thursday. The alleged plot included a plan to attack a U.S. military installation in Illinois. In the past 18 months, the Justice Department's National Security Division has prosecuted or is prosecuting 32 cases of people attempting to travel abroad to join or providing support to terrorist groups. Of""
 'of conspiring to provide material support and resources to a foreign terrorist organization. The cousins made an initial appearance Thursday afternoon before U.S. Magistrate Judge Sheila Finnegan. Why is ISIS so successful at luring Westerners? After an undercover FBI informant posing as an ISIS fighter outside the United States sent Hasan Edmonds a Facebook ""friend"" request in late 2014, he began to receive private messages from him indicating that he and his cousin were willing to travel to'
 'depart Wednesday from Chicago and arrive in Cairo on Thursday. The cousins presented an undercover informant with plans to attacks the military facility, prosecutors said. Who has been recruited to ISIS from the West? ""Disturbingly, one of the defendants currently wears the same uniform of those they allegedly planned to attack,"" Carlin said in the statement. Conspiring to provide material support to a foreign terrorist organization carries a maximum penalty of 15 years in prison and a $250,000'
 'media accounts, online phone directories and other accessible public records. In late November, the FBI issued a warning to U.S. military members that ISIS was calling for attacks against them, a law enforcement source told CNN. The source said that ""overseas based individuals are looking for like-minded individuals in the U.S. to carry out these attacks."" The warning asked members of the military to ""review their online social media presence for any information that might attract the attention'
 'to join ISIS. That\'s ludicrous. They aren\'t terrorists."" A federal complaint alleges that Hasan Edmonds came to the attention of the FBI in late 2014. The complaints uses the acronym ISIL, or Islamic State of Iraq and the Levant. Hasan Edmonds planned to use his military training to fight for the terrorist organization, prosecutors said in a statement. Hasan Edmonds booked airline travel to depart Wednesday from Chicago and arrive in Cairo on Thursday. The cousins presented an undercover'
 'their passports. The 21-year-old California man was arrested last summer, but was indicted on Wednesday. The FBI said he attempted to offer himself and material support to work under the direction and control of ISIS. His arraignment is scheduled for later this month. The 17-year-old Virginia student has been charged with helping recruit for ISIS, federal law enforcement officials said Wednesday. The teen lives in a suburb of Washington and is accused of helping a slightly older adult travel to'
 'The teen lives in a suburb of Washington and is accused of helping a slightly older adult travel to Syria. The adult is believed to have joined ISIS there. The student is also accused of distributing ISIS messages. Arrested last month in New York and Florida, they are accused by the federal government of attempting to join ISIS and of fostering plans to kill the President and shoot law enforcement officers. The three men face charges that include attempting and conspiring to provide material']","The undercover FBI informant played a crucial role by posing as an ISIS fighter and sending Hasan Edmonds a Facebook ""friend"" request in late 2014. This led to private messages indicating that Hasan and his cousin were willing to travel to join ISIS. The informant also received plans from the cousins to attack a U.S. military facility, which contributed to their arrest.","The undercover FBI informant played a role in the arrest by sending a Facebook friend request to Hasan Edmonds, posing as an ISIS fighter. This led to private messages between the informant and Hasan Edmonds, where they discussed their willingness to travel overseas and fight for ISIS. The informant provided information to the authorities, which ultimately led to the arrest of Hasan Edmonds and his cousin.",0.8091128253715165,0.5,0.8314525668321506,0.9999999999857143
How does the new Red brand aim to leverage Radisson's brand awareness?,"['which is hueing (sic) toward Red and Blu. Blu came about in 2009, after airline SAS withdrew from a partnership with Radisson. After the split, Radisson SAS, a collection of European design hotels, needed a new name. ""We wanted to replace SAS with an equally short name,"" says Rose Anderson, vice president of branding for the Carlson Rezidor Hotel Group. ""We liked using blue from the old SAS logo, because it brought in the heritage of the former brand. ""At the same time, we were looking for a'
 'because it brought in the heritage of the former brand. ""At the same time, we were looking for a word with positive worldwide connotations ... and blue is the world\'s favorite color."" So blue or bleu became Blu, a trademarkable spelling. Carlson Rezidor recently announced a new Red brand that will, according to Anderson, ""build on the Blu concept and further leverage Radisson\'s brand awareness."" New brands are also being dubbed with what may seem to be random nouns. But there\'s nothing random'
 'Design, a branding firm brought in to hone the name and the image. Hence Vib, which is derived from ""vibrant."" Color also plays a big part in hotel branding. ""We incorporated a bright persimmon red in the design and the logo, in order to reflect the (Vib) brand\'s bold personality,"" says Lew. Moxy, the new Marriott partnership with IKEA, is going after ""a sassy, determined, individualistic consumer,"" according to Marriott\'s Von Ertfelda. The first Moxy opened at Milan\'s Malpensa Airport in'
 'had to be \'ownable and trademarkable.\'"" The change of spelling from moxie to Moxy achieved that. According to Von Ertfelda, senior creative director Maria Rezende-Heiston selected hot pink for the Moxy logo to ""appeal to those who aren\'t afraid to express themselves"" while using a ""curved font to convey a sense of rhythm, fluidity and independence."" Color is also key to hotel operator Carlson Rezidor, which is hueing (sic) toward Red and Blu. Blu came about in 2009, after airline SAS withdrew'
 'Whenever"" tagline to the simple W logo. Cornell\'s Dev says Starwood further imbued the brand with meaning by using words like witty, warm and welcoming in its advertising and marketing material. More than 15 years later, the W Hotel brand has more than 70 properties open or in development worldwide. Journalist Laura Powell started covering the travel industry for CNN in the 1980s. Her focus is on  international travel news and trends. Read more of her work at www.dailysuitcase.com. Twitter:'
 ""New brands are also being dubbed with what may seem to be random nouns. But there's nothing random about them. Last year, InterContinental Hotels Group (IHG) rolled out EVEN, a new brand cultivated for the growing wellness-minded audience, with two properties in the United States. EVEN expresses the desire for the balance travelers are seeking, says an IHG spokesperson. In its logo, specific colors were chosen to represent elements of nature. The four vertical bars of the logo are off-kilter,""]",The new Red brand aims to leverage Radisson's brand awareness by building on the Blu concept. This strategy involves using the established recognition and positive associations of the Radisson brand to promote and develop the new Red brand.,The new Red brand aims to leverage Radisson's brand awareness by building on the Blu concept and further leveraging Radisson's brand awareness.,0.808098403507282,1.0,0.9527602484489356,0.99999999995
When are the peak blooms expected during the National Cherry Blossom Festival in Washington?,"[""Washington (CNN)There should be plenty of pent-up anticipation among cherry blossom fans in Washington this spring. Peak blooms are expected at the tail end of the three-week-long National Cherry Blossom Festival, which kicks off Friday and runs through April 12. The fluttering pink and white blossoms are expected to hit their peak between April 11 and April 14. Here are five things to know about the eagerly awaited D.C. blossoms: . The city's first cherry trees were destroyed . In 1910, 2,000""
 ""in 1934 and a 1927 re-enactment of the original planting of the trees by a group of Washington school children. It's not all about cherry trees . That's right, there's a Blossom Kite Festival right in the middle of the cherry blossom festivities on March 28th. The festival consists of a hot tricks showdown, learning how to make and fly kites, and there's even a kite doctor on site to repair broken kites. Two types of trees dominate . In the 1912 gift of trees to Washington, there were 12""
 'Herron Taft planted one of the first of more than 3,000 replacement trees sent from Japan. Winter\'s almost over: See the proof . The festival was launched more than 20 years later . It wasn\'t until 1935 that civic groups and the D.C. government came together to hold the first ""Cherry Blossom Festival."" That first official festival came after smaller commemorations including a three-day celebration in 1934 and a 1927 re-enactment of the original planting of the trees by a group of Washington'
 ""the eagerly awaited D.C. blossoms: . The city's first cherry trees were destroyed . In 1910, 2,000 cherry trees arrived in Washington, thanks to a gift from the city of Tokyo and the advocacy of Eliza Ruhamah Scidmore, one of the first female board members of the National Geographic Society. These trees, however, were riddled with disease and were destroyed. Two years later, first lady Helen Herron Taft planted one of the first of more than 3,000 replacement trees sent from Japan. Winter's""
 ""broken kites. Two types of trees dominate . In the 1912 gift of trees to Washington, there were 12 different varieties. Today, two varieties are dominant -- Yoshino and Kwanzan. Kwanzan trees are usually found in the East Potomac Park area and produce pink blossoms. The Yoshino, which produce white blossoms, are closer to the northern part of the Tidal Basin near the Washington Monument. Descendants of the original trees live in Japan . In 2011, about 120 trees propagated from D.C.'s surviving""]",The peak blooms are expected between April 11 and April 14 during the National Cherry Blossom Festival in Washington.,The peak blooms are expected between April 11 and April 14.,0.7362708633230685,1.0,1.0,0.9999999999
What is Zhanna Nemtsova's opinion on the Russian investigation into her father's assassination?,"['Nemtsov had also been arrested several times for speaking against the government. In her first TV interview since her father\'s death, Nemtsova told CNN that Putin shares ""political responsibility"" for her father\'s assassination. She spoke from Germany. ""I don\'t believe in the official investigation,"" she said Saturday. Other opposition figures previously jailed or killed include Anna Politkovskaya, a journalist critical of Russia\'s war in Chechnya. She was gunned down at the entrance to her'
 'Moscow (CNN)Russia\'s president shares ""political responsibility"" for the assassination of opposition leader Boris Nemtsov, the late politician\'s daughter said Friday in her first TV interview since his death in central Moscow last week. Zhanna Nemtsova, who said she has no faith in the Russian investigation into the killing, said she believes his death will only deter other opposition voices, rather than embolden them. ""I cannot blame him (Putin) directly, (but) I would say that our authorities,'
 'but many Nemtsov supporters suspect Putin\'s administration of involvement. How Boris Nemtsov\'s murder serves notice to Vladimir Putin\'s enemies . Putin this week called the killing a ""disgrace"" and a tragedy, and he promised to bring those responsible to justice. But Nemtsova, 30, said she does not believe that will happen. She said investigators have not contacted her and she knows nothing of the case except what is in the media. ""I don\'t know where his cellphone and his personal belongings'
 'of Malgobek and the village of Voznesenovskaya, while Dadayev was arrested in the city of Magas, Barakhayev told TASS. The slain opposition leader\'s daughter, Zhanna Nemtsova, told CNN she is ""not surprised both of them (are) of Caucasus origin. It was predictable."" Nemtsova said the only things she knew about the arrests came from media reports, as authorities did not contact her immediately. Later Saturday, a southern Russian law enforcement official told state news agency RIA Novosti that'
 'the case except what is in the media. ""I don\'t know where his cellphone and his personal belongings are, so I know only those things which are released or published in the press and nothing else, nothing else,"" she told CNN from Germany, where she is staying for a few days. ""As I have already said, I don\'t have any faith in this investigation."" Nemtsova said she loved her father ""more than anyone else in my life"" and that the two were very close. ""I think that he died a hero,"" she said. ""He was'
 'said Yevhen Perebyinis, a spokesman for Ukraine\'s Foreign Ministry. Inna Duritskaya told CNN that while being questioned, her daughter faced constant psychological pressure from Moscow authorities and that she fears she will be implicated in his death. In a Skype interview with Dozhd, Anna Duritskaya indicated her continued presence in Moscow after the shooting was not from choice -- and seemed to appeal to be allowed to leave. ""Now I have a status of a witness, I gave all evidence possible, I'
 ""were convicted of killing journalist Anna Politkovskaya, for example, but there still is no explanation of why they did it or who organized the murder. Now, with Nemtsov's killing, Russian officials and Kremlin-friendly media have whipped up a sandstorm of theories, confounding the most intrepid attempts at establishing the truth. Will things play out any differently this time?""]",Zhanna Nemtsova has no faith in the Russian investigation into her father's assassination. She believes the authorities are not genuinely pursuing justice and suspects political motives behind the investigation. She only knows details about the case from media reports and has not been contacted by investigators.,Zhanna Nemtsova said she has no faith in the Russian investigation into the killing.,0.48425807299268453,0.6,0.99490739904978,0.9999999999857143
Who was one of Putin's harshest critics?,"['be heading an opposition party and do what I\'m doing."" Opinion: The complicated life and tragic death of Boris Nemtsov . Critics of Putin have in the past suffered miserable fates. Last year, a Moscow court sentenced five men to prison for the 2006 killing of Russian journalist and fierce Kremlin critic Anna Politkovskaya. Business magnate Mikhail Khodorkovsky accused Putin of corruption and spent 10 years in prison and labor camps. Late last year, Kremlin critic Alexey Navalny was found guilty'
 ""look at some cases of outspoken critics of Putin's government who've ended up in exile, under house arrest, behind bars or dead. The business magnate backed an opposition party and accused Putin of corruption. He spent more than 10 years behind bars on charges of tax evasion and fraud. In statements to CNN, Khodorkovsky said his prosecution was part of a Kremlin campaign to destroy him and take control of Yukos, the oil company he built from privatization deals in the 1990s. The Kremlin denied""
 ""(CNN)Slain Russian opposition leader Boris Nemtsov isn't the first critic of President Vladimir Putin to turn up dead. Some Putin opponents claim it isn't a coincidence that critics of the powerful leader and his government have been killed or landed behind bars. But the Kremlin has staunchly denied accusations that it's targeting political opponents or had anything to do with the deaths. Here's a look at some cases of outspoken critics of Putin's government who've ended up in exile, under house""
 ""a journalist critical of Russia's war in Chechnya. She was gunned down at the entrance to her Moscow apartment in 2006. There was also business magnate Mikhail Khodorkovsky, who backed an opposition party and accused Putin of corruption. Khodorkovsky landed in jail after a conviction on tax fraud, which he said was a ploy to take away his oil company. The government rejected the claim. Putin pardoned him in 2013. Former Russian security agent Alexander Litvinenko was poisoned by a lethal dose""
 'Other critics of Putin who ended up dead . Putin has a history of viciously attacking the most important person in any given group of enemies, in order to send a message to the rest of them. In 2003, he did this by arresting and imprisoning the richest oligarch in the country, Mikhail Khodorkovsky. When Khodorkovsky was put on trial in 2004, Putin allowed the television cameras film the wealthiest man in the country sitting in a cage. Imagine that you were the 17th richest man in Russia, and'
 'with the Republican Party of Russia-Party of People\'s Freedom, a liberal opposition group. He served as deputy prime minister in the late 1990s under President Boris Yeltsin. Early in his career, he was governor of Nizhniy Novgorod, a major economic hub. ""I think that now, Russia has crossed the line after this murder, and people will be frightened to express their ideas which contradict ... the official standpoint,"" Nemtsova said. CNN\'s Matthew Chance reported from Moscow. CNN\'s Melissa Gray'
 ""shooting Putin blamed extremists and protesters who he said were trying to stir internal strife in Russia. Many opposition sympathizers and people close to Nemtsov have pointed the finger at Putin and the Russian government he leads. They note that Nemtsov -- the deputy prime minister under former President Boris Yeltsin -- is the latest in a list of Putin's opponents who have been killed or imprisoned. Nemtsov had also been arrested several times for speaking against the government. In her""
 'at the Kremlin\'s current policies on Ukraine. Other prominent Russian figures at the service included Deputy Prime Minister Arkady Dvorkovich, Prime Minister Dmitry Medvedev\'s spokeswoman Natalya Timakova, and former Finance Minister Alexey Kudrin. Russian economist Yevgeny Yasin, who served as economy minister between 1994 and 1997 and is now an academic, said: ""Nemtsov always said everything that others were afraid to say."" Evgeniya Albats, editor-in-chief of The New Times magazine, described'
 ""But many Russians I've spoken to since the killing are, in fact, very afraid. And while the hope among opposition activists is that Nemtsov's killing may at least invigorate their ranks, one very real possibility is that it will do the exact opposite: further silence an already very quiet minority opposed to the rule of Vladimir Putin.""
 ""Moscow (CNN)Ever since Vladimir Putin came to power, there have been killings of politicians, of human rights activists, of journalists. Boris Nemtsov, one of Russia's most prominent opposition figures, is only the latest victim. The key thing all these crimes have in common is that none of them get properly resolved. Of course, the Kremlin will issue condemnation and condolences, as it has done over the assassination of Nemtsov. But the killers and the people who ordered the killings don't""]",One of Putin's harshest critics was Boris Nemtsov.,Boris Nemtsov,0.22962419743133142,1.0,1.0000000000000002,0.9060405643638305
"What factors could affect the selection of the new Senate Democrats leader, considering left-leaning activists and organized labor's concerns about free trade agreements?","['organizations as he aggressively pursued global free trade policies that labor opposed. ""It will cost jobs,"" warned Michigan Democrat David Bonior said of the North American Free Trade Agreement that Clinton endorsed. ""It will drive down our standard of living. If we don\'t stand up for the working people in this country, who is going to?"" In the past few decades, many Democratic politicians no longer believed that organized labor was a major player within their party, as they had been during'
 'does not abandon what has been at the heart and soul of their agenda. As Democrats continually watch Republicans outdo them in terms of organization and pursuit, they need to look to labor more as an ally than an enemy in the battle for the White House and Congress in the coming years.'
 'of middle-class voters. Those who wonder what a Schumer Senate leadership would look like should take a look as Democrats prepare for what could well be the start of the Schumer era on Capitol Hill.'
 '(CNN)Organized labor is up in arms about President Barack Obama\'s effort to obtain fast-track authority to finalize a free trade agreement in the Asia Pacific that involves 11 nations. The agreement, union leaders argue, threatens to take even more jobs away from Americans. AFL-CIO President Richard Trumka sent a clear message to members of Congress, warning, ""There is such a dramatic impact on the standard of living and lowering of wages and a loss of jobs -- this will have a major impact, and'
 'York\'s senior senator prepares to seize the reins of power -- and retool the party as a center-left powerhouse that can win and hold a majority in 2016 and beyond. Left-leaning activists have begun scrambling to block Chuck Schumer\'s rise. The progressive organization Democracy for America is calling for Sen. Elizabeth Warren to seek the leadership post, and the left-leaning Daily Kos website is circulating a poll seeking other challengers and denouncing Schumer as too close to the ""Wall Street'
 'longer believed that organized labor was a major player within their party, as they had been during the creation of the New Deal and Great Society. As organized labor became a smaller part of the American workforce, Democratic politicians were not as determined to court their vote. A larger number of Democrats since the 1970s have been elected by upper middle class suburban constituencies in which unions are not a big presence. These voters have been more concerned in a style of liberalism that'
 'unions are not a big presence. These voters have been more concerned in a style of liberalism that revolves around quality of life issues, such as environmental regulation, than they are with middle class jobs. Many Democrats leaders embraced a vision of economic policy that centered on deregulation and free markets. New voices that came into the Democratic Party after the 1960s wanted to challenge Republicans by offering a more centrist vision of economic policy. The opportunities for'
 'and those that do their bidding remove workers\' primary means of raising wages, securing pensions and improving workers conditions. Workers\' main vehicle for advancing themselves and their communities is jeopardized."" Democrats need to listen to what the AFL-CIO is saying. They need to push back against President Obama, even if this creates political opportunities for Republicans, so that the party does not abandon what has been at the heart and soul of their agenda. As Democrats continually']","The selection of the new Senate Democrats leader could be influenced by left-leaning activists' opposition to candidates perceived as too close to Wall Street, such as Chuck Schumer, and their preference for more progressive leaders like Elizabeth Warren. Additionally, organized labor's concerns about free trade agreements and their impact on jobs and wages could push Democrats to choose a leader who is more aligned with labor interests and willing to oppose such agreements. The need to balance the interests of upper middle-class suburban constituencies with those of organized labor and progressive activists will also play a significant role.","Left-leaning activists and organized labor's concerns about free trade agreements could affect the selection of the new Senate Democrats leader. Activists are calling for Sen. Elizabeth Warren to seek the leadership post, while labor unions are concerned about the impact of free trade agreements on jobs and wages. These factors could influence the decision-making process and potentially lead to a different leader being chosen.",0.6150168437139713,1.0,0.9362516379714836,0.9999999999875
"How did the USS Sterett and USS New York coordinate the rescue of the Saudi Arabia air force pilots in the Gulf of Aden, and what was the role of the Djibouti rescue helicopter?","['(CNN)The U.S. Navy rescued two Saudi Arabia air force pilots from the Gulf of Aden, a U.S. military official said Friday. The pilots had ejected from their F-15 aircraft after it suffered mechanical failure, Saudi officials told U.S. sources. The two were not seriously injured. The USS Sterett, a guided-missile destroyer, coordinated the search, while the USS New York looked for the men. A rescue helicopter flew from Djibouti to retrieve them on Thursday. Saudi Arabia is leading a coalition'
 'helicopter flew from Djibouti to retrieve them on Thursday. Saudi Arabia is leading a coalition military operation to quell a rebellion by Houthi militias in Yemen. The United States supports the operation,  but is not participating in it. Three U.S. Navy ships are standing by in the Gulf of Aden for future recovery operations. U.S. manned aircraft are not permitted to fly in Yemen airspace under the current rules of engagement.'
 'appeared to be OK, but then -- even in route -- made the decision (that) the risk was too high."" The second helicopter lost communication with the missing aircraft and returned to begin the search operation, Osterman said. That operation has transitioned from rescue to recovery, with the military focused on recovering the helicopter, military officials said. Searchers found the helicopter at the bottom of the sound, and the bodies of the seven Marines and four Army National Guard members who'
 'a sonar hit, a diver found the bulk of the wreck at the bottom of the sound, Giuliano said. Divers then went into the water ""to start retrieving the aircrew,"" Giuliano said, without specifying how many bodies were recovered. The helicopter had broken into several pieces in a ""high-impact crash,"" he said. The Coast Guard has hired a salvage company from Mobile, Alabama, to take the wreckage from the water, Giuliano said. On Wednesday, Gen. Martin Dempsey, chairman of the Joint Chiefs of Staff,'
 ""the coalition's efforts. While it is helping the Saudi-led team with logistics and locating targets, the U.S. is not participating in active battle. Dozens have died in the airstrikes, Houthi commanders said. The rebel commanders also said the coalition struck the Houthi-controlled Al Anad air base, which was used as the headquarters for U.S. counterterrorism operations before Houthi rebels took control of it. The Houthis claimed they shot down a Sudanese jet and captured the pilot on Saturday.""
 'the pilot. They distributed photos of a pilot and wreckage to back up the claim. Iran and Saudi Arabia are bitter rivals. Having Yemen become an Iranian satellite country on its border would be unacceptable to the kingdom. Iran has sharply denounced the Saudi-dominated armed intervention. And two Arab League members, Lebanon and Iraq, have voiced opposition to Determination Storm, Lee reported. Both countries are majority Shiite. Israeli Prime Minister Benjamin Netanyahu pointed to Yemen on'
 'roles including peacekeeping operations, international disaster relief and aid."" He added that its helicopter capabilities -- it can host seven anti-submarine patrol helicopters, plus two rescue and transport helicopters, the Japan Times reported -- would aid in the detection of sophisticated Chinese submarines. Japan, along with the Philippines and Vietnam, is engaged in territorial disputes with China over the sovereignty of islands in the South China Sea, and Kazuhisa Ogawa, a defense'
 ""Saudi Arabia, which sees the Houthis as proxies of Tehran, Saudi Arabia's bitter rival on the Persian Gulf. Iran has sharply denounced the armed intervention. The United States, on the other hand, strongly approves of it and is supporting it logistically, and aiding coalition forces in locating targets, but it is not participating in active battle. A small contingency of U.S. forces had been stationed in Yemen to help in the fight against Al Qaeda in the Arabian Peninsula, but left once Houthi""
 ""the helicopter, which searchers found at the bottom of the Santa Rosa Sound near Eglin Air Force Base, as well as the bodies of all seven Marines and four Louisiana Army National Guard members who were aboard. CNN's Greg Botelho contributed to this report.""
 'States, which has worked with Yemeni governments -- including that of recently deposed but still battling President Abdu Rabu Mansour Hadi -- to go after al Qaeda in the Arabian Peninsula. In fact, a senior official in President Barack Obama\'s administration said ""there will be no military intervention by the U.S."" But U.S. Secretary of State John Kerry on Thursday did tell foreign ministers from Saudi Arabia, the UAE, Qatar, Kuwait, Bahrain and Oman that the United States commends the military']","The USS Sterett coordinated the search for the Saudi Arabia air force pilots, while the USS New York assisted in looking for them. A rescue helicopter from Djibouti was dispatched to retrieve the pilots on Thursday. The pilots had ejected from their F-15 aircraft after it suffered mechanical failure.","The USS Sterett, a guided-missile destroyer, coordinated the search for the Saudi Arabia air force pilots in the Gulf of Aden. The USS New York looked for the pilots. A rescue helicopter flew from Djibouti to retrieve them.",0.6530081437149231,0.75,0.9482593256330035,0.7142857142714285
When will Hillary Clinton announce her 2016 presidential campaign and who will replace Harry Reid as the leader of the Senate Democrats?,"['(CNN)Sen. Harry\'s Reid\'s perfunctory announcement on Friday that he won\'t seek re-election next year -- leaving a vacancy for leadership of the Senate Democrats -- was followed, hours later, by a matter-of-fact statement in an interview with The Washington Post: ""I think Schumer should be able to succeed me."" That would usher in a whirlwind of activity on Capitol Hill in the next year as New York\'s senior senator prepares to seize the reins of power -- and retool the party as a center-left'
 '(CNN)Hillary Clinton held a closed door meeting with President Barack Obama at the White House on Monday.  Although the former secretary of state, senator and first lady has not declared, it is treated as a foregone conclusion that Clinton is running for president. Likely to launch her campaign in April, Clinton is regarded as the front-runner — if not the only Democratic candidate — and the inevitable Democratic nominee. There is an assumption that since Clinton supported Obama, the black'
 ""show signs of putting their ambitions aside for the sake of party unity. Republican primary battles aren't going anywhere in 2016, and on the presidential level, Democrats continue to line up behind Hillary Clinton as their nominee, without a whiff a serious primary challenge. But there is a different story unfolding in the next race for the Senate, where the question is whether Democrats will cleave along ideological and generational lines in primary fights, jeopardizing the party's hopes of""
 'Wall Street. And now that Senate Minority Leader Harry Reid is planning to retire -- creating an opening in the top Senate Democratic job -- you are about to hear this: Warren has to run for leader because Chuck Schumer is too cozy with Wall Street. The senator from Massachusetts is likely to give the same answer as she did on a presidential run, but Jackie Kucinich of The Daily Beast says the liberal clamoring tells us something about anxiety on the left. ""What this does show is there is a lot'
 'Washington (CNN)A Florida ""dream ticket,"" two nuggets about leadership questions in Congress and coming tests for Sen. Ted Cruz and Ohio Gov. John Kasich filled our final March trip around the ""Inside Politics"" table. 1.  Another ""Draft Warren"" movement? If you follow politics, you have heard this one: Liberals say Elizabeth Warren has to run for president because Hillary Clinton is too cozy with Wall Street. And now that Senate Minority Leader Harry Reid is planning to retire -- creating an'
 '-- weren\'t really interested. ""People very much want to know what the campaign is going to be about ... what is she going to do about student loan costs, for example?"" Tharon Johnson, a Democratic strategist who was Southern regional director of Obama\'s re-election campaign in 2012, agreed. ""If and when Hillary Clinton decides to run, she will have to address this issue, but I believe the American people are more interested in her addressing the kitchen table issues that matter most to them,""']",Hillary Clinton is likely to announce her 2016 presidential campaign in April. Sen. Harry Reid suggested that Chuck Schumer should succeed him as the leader of the Senate Democrats.,Hillary Clinton is expected to announce her 2016 presidential campaign in April. Chuck Schumer is expected to replace Harry Reid as the leader of the Senate Democrats.,0.7456863609574185,0.5,0.874571340227131,0.9999999999833333
What does King Abdullah II think about ISIS establishing a caliphate and Bashar al-Assad's stance on combating ISIS?,"['of dealing with"" the al-Assad regime and the ""history of dealing with"" ISIS are two separate things. ""What has taken prominence at the moment is ISIS, Daesh,"" he said. Abdullah rhetorically asked whether both issues can be dealt with at the same time. ""This has to be decided by the international community,"" he said. ""We believe there has to be a political solution"" in Syria, and that has ""not been clarified at the moment.""'
 'have that Syrian President Bashar al-Assad is interested in combating ISIS, meaning al-Assad and Abdullah have common enemies. ISIS has gained strength by exploiting the unrest in Syria during its ongoing civil war. That war is the result of unrest in Syria that originally started in 2011 within the context of the Arab Spring, protests for democracy or changes in government that raged in parts of the Middle East and North Africa in 2010 and 2011. Syrian protesters, in 2011, wanted to bring'
 'in retaliating against ISIS. The country unleashed airstrikes. To Zakaria, Abdullah reiterated his commitment to stop ISIS. He called its fighters ""outlaws"" who twist Islam and use ""intimidation"" as their biggest weapon. The King told Zakaria that he didn\'t watch the video of the pilot\'s slaying. ""I -- many of us refused to see what I think is propaganda,"" Abdullah said. He felt ""disgust, sadness for the family"" and his ""heart went out to the father, the mother, the brothers, the sisters,"" the'
 'past year and a half?"" Jordan has a ""responsibility to reach out to eastern Syria"" and to western Iraq where people have been ""executed in large numbers"" by ISIS, Abdullah insisted. ""So this is our war,"" he said. ""We have a moral responsibility to reach out to those Muslims to protect them and stop (ISIS) before they reach our border."" Zakaria asked Abdullah what he thinks about the perception some have that Syrian President Bashar al-Assad is interested in combating ISIS, meaning al-Assad and'
 'to ISIS members as Islamic extremists because their actions are not Islamic. ""I think he is right,"" Abdullah said. ""This is something that has to be understood on a much larger platform. (ISIS) is looking for legitimacy (that) they have inside of Islam."" ""I\'m a Muslim,"" the King said. ""These people (ISIS members) ... are on the fringe of Islam."" ""The barbarity with the way they executed our brave hero (the pilot), I think, shocked the Muslim world, especially Jordanians and people from this'
 ""more than a month, al-Kasasbeh's family, hailing from a high-ranking tribe considered especially loyal to Jordan's royal family, implored ISIS to let him go. Hope that he could be spared ended in early February when a video emerged showing the 29-year-old pilot in a cage, being burned alive. King Abdullah II, an instrumental supporter of the global coalition, then said Jordan would be relentless in retaliating against ISIS. The country unleashed airstrikes. To Zakaria, Abdullah reiterated his""]","King Abdullah II believes that ISIS members are extremists who twist Islam and seek legitimacy within the religion, but they are on the fringe of Islam. He acknowledges that Syrian President Bashar al-Assad is interested in combating ISIS, which means they have a common enemy. However, Abdullah emphasizes that the international community must decide how to address both ISIS and the al-Assad regime, advocating for a political solution in Syria.","During his interview with Zakaria, the King repeatedly referred to ISIS, the Islamic State of Iraq and Syria, as Daesh. That's an acronym for al-Dawla al-Islamiya al-Iraq al-Sham. Many in the Middle East prefer to use Daesh because, to them, the acronym ISIS suggests the terror group is a legitimate state. They refuse to give the militants that much credit.",0.6597360427725961,0.7142857142857143,0.9445861760119004,0.9999999999666667
What nationalities were the Bardo Museum attack victims and how did the Tunisian security forces respond?,"['the prestigious Bardo Museum in central Tunis, the country\'s tourism industry is once again facing jeopardy even as authorities and operators scramble to ensure the safety of visitors currently in the country. A significant number of foreign tourists were inside the museum at the time of the attack, which government officials said was the work of ""Islamists."" Prime Minister Habib Essid said Polish, Italian, German and Spanish tourists are among those killed, with another 20 tourists plus two'
 ""(CNN)At least a dozen tourists on two cruises that visited the Tunisian capital, Tunis, are among more than 20 people who were gunned down this week at the country's Bardo National Museum, officials said. Details of the victims in Wednesday's attack have been slow to emerge. Some of the bodies remained unidentified at a morgue, a forensic official said Friday. Here's what is known so far: . Among the first victims to be named was Briton Sally Adey. The UK Foreign Office confirmed her identity.""
 ""Tunis (CNN)The bodies of four Italian tourists slain in a terror attack on Tunisia's Bardo Museum three days ago arrived back in Italy on Saturday, an official with the Tunis Crisis Center told CNN, but 14 victims' remains still lie in the morgue. As Tunisia gets back on its feet, the investigation into Wednesday's shooting at the Tunis landmark continues. Most of the 23 victims were foreigners, making the process of identification more complicated. Nineteen of them were tourists who'd been on""
 ""(CNN)Wednesday's terrorist attack, which killed 23 people, hit Tunisia where it hurt by targeting its flourishing tourism industry. The deadly attack on the prominent Bardo Museum near Tunisia's parliament in the country's capital, Tunis, is the latest instance of an armed assault carried out by gunmen willing to fight to the death, a tactic that has been widely adopted by jihadist terrorists in recent years, including in North Africa. Such attacks mimic the 2008 Mumbai assaults in which 10""
 ""(CNN)Gunmen killed 19 people and sent tourists scrambling for cover in a siege at a museum in Tunisia's capital on Wednesday. The North African nation's Prime Minister called it a cowardly terrorist attack and warned that three suspects were still on the loose. Tunisian security forces killed two attackers as they ended the hostage siege at the Bardo Museum in Tunis, Prime Minister Habib Essid said. But the death toll, which included 17 tourists and at least one Tunisian security officer, could""]","The victims of the Bardo Museum attack included Polish, Italian, German, Spanish, and British tourists, among others. Tunisian security forces responded by killing two attackers and ending the hostage siege. However, three suspects were still on the loose according to the Prime Minister.","The victims of the Bardo Museum attack included individuals from various nationalities, including Spain, Colombia, Italy, Japan, France, Poland, Belgium, Russia, and the United Kingdom. Tunisian security forces responded quickly to the attack and were able to prevent further tragedy by neutralizing the attackers and avoiding the use of explosives that were found on them.",0.6150949645959163,0.8,0.9470330296137991,0.99999999998
How did W Hotels become a pioneer in the hospitality industry by understanding millennials?,"['properties will be ""hip and happening hotels"" that ""move to the rhythm of today\'s curious global traveler"" who has a ""desire to embrace authentic experiences in a city hotel."" You can\'t explore the hospitality industry\'s desire to appeal to the millennial mindset without nodding to W Hotels by Starwood. The brand now seems to have been ahead of its time with hotels that opened in pre-social media 1998. ""Starwood was the first hotel company to look directly at the customer as it evolved a new'
 '1998. ""Starwood was the first hotel company to look directly at the customer as it evolved a new brand,"" says Paul James, global brand leader of W Hotels Worldwide, St. Regis and The Luxury Collection. W\'s target customer was a fashionable, high-energy individual -- someone who\'d now likely be described as having a millennial psychographic. Starwood defined the brand by adding its ""Whatever, Whenever"" tagline to the simple W logo. Cornell\'s Dev says Starwood further imbued the brand with'
 'Whenever"" tagline to the simple W logo. Cornell\'s Dev says Starwood further imbued the brand with meaning by using words like witty, warm and welcoming in its advertising and marketing material. More than 15 years later, the W Hotel brand has more than 70 properties open or in development worldwide. Journalist Laura Powell started covering the travel industry for CNN in the 1980s. Her focus is on  international travel news and trends. Read more of her work at www.dailysuitcase.com. Twitter:'
 'way,"" says Matthew Von Ertfelda, Marriott\'s vice president for insight, strategy and innovation. The explosion of social media also has a starring role in the name game. Brands of the 21st century need to have handles that resonate in the global, online world, say the pros. ""Thanks to social media, millennials are the first global generation,"" says Dr. Donna Quadri-Felitti, academic chair of New York University\'s School of Professional Studies Tisch Center for Hospitality and Tourism. ""And'
 'Look to millennials and psychographics -- the study of personality, attitudes, interests and lifestyles. Psychologists say the millennial psychographic is made up of independent-minded, adventurous individuals in search of new experiences. Hospitality brands are crafting their marketing strategies accordingly. ""Hotel companies are lazering in on consumer needs by using psychographic data in a big way,"" says Matthew Von Ertfelda, Marriott\'s vice president for insight, strategy and innovation.']","W Hotels became a pioneer in the hospitality industry by targeting a fashionable, high-energy customer who embodies the millennial psychographic, even before the term was widely used. They introduced the ""Whatever, Whenever"" service philosophy and used marketing language that resonated with millennials, such as witty, warm, and welcoming. This approach allowed them to appeal to the desires of millennials for authentic and engaging experiences in city hotels.","W Hotels became a pioneer in the hospitality industry by understanding millennials through their focus on the fashionable, high-energy individual and by using words like witty, warm, and welcoming in their advertising and marketing material. They also defined the brand with their ""Whatever, Whenever"" tagline, which resonated with the millennial psychographic. This understanding of millennials helped W Hotels to establish a strong presence in the industry with over 70 properties worldwide.",0.8072463720769161,1.0,0.9330547329271822,0.8874999999778125
"Why were the first cherry trees in Washington, D.C. destroyed and who planted the replacement trees?","[""the eagerly awaited D.C. blossoms: . The city's first cherry trees were destroyed . In 1910, 2,000 cherry trees arrived in Washington, thanks to a gift from the city of Tokyo and the advocacy of Eliza Ruhamah Scidmore, one of the first female board members of the National Geographic Society. These trees, however, were riddled with disease and were destroyed. Two years later, first lady Helen Herron Taft planted one of the first of more than 3,000 replacement trees sent from Japan. Winter's""
 'Herron Taft planted one of the first of more than 3,000 replacement trees sent from Japan. Winter\'s almost over: See the proof . The festival was launched more than 20 years later . It wasn\'t until 1935 that civic groups and the D.C. government came together to hold the first ""Cherry Blossom Festival."" That first official festival came after smaller commemorations including a three-day celebration in 1934 and a 1927 re-enactment of the original planting of the trees by a group of Washington'
 ""of the original trees live in Japan . In 2011, about 120 trees propagated from D.C.'s surviving 1912 trees were sent back to Japan to preserve the genetic lineage of the symbolic trees. Over the years, cuttings from the original trees have also been returned to Japan for horticultural projects.""
 ""in 1934 and a 1927 re-enactment of the original planting of the trees by a group of Washington school children. It's not all about cherry trees . That's right, there's a Blossom Kite Festival right in the middle of the cherry blossom festivities on March 28th. The festival consists of a hot tricks showdown, learning how to make and fly kites, and there's even a kite doctor on site to repair broken kites. Two types of trees dominate . In the 1912 gift of trees to Washington, there were 12""
 ""broken kites. Two types of trees dominate . In the 1912 gift of trees to Washington, there were 12 different varieties. Today, two varieties are dominant -- Yoshino and Kwanzan. Kwanzan trees are usually found in the East Potomac Park area and produce pink blossoms. The Yoshino, which produce white blossoms, are closer to the northern part of the Tidal Basin near the Washington Monument. Descendants of the original trees live in Japan . In 2011, about 120 trees propagated from D.C.'s surviving""]","The first cherry trees in Washington, D.C. were destroyed because they were riddled with disease. The replacement trees were planted by First Lady Helen Herron Taft in 1912.","The first cherry trees in Washington, D.C. were destroyed due to disease. The replacement trees were planted by first lady Helen Herron Taft.",0.676616990343034,0.75,0.9422799748624793,0.99999999995
How can the government protect middle class jobs and address economic inequality and insecurity?,"['up the strength of unions is one area where the government can help protect jobs for middle class Americans. Without strong unions, the battle against economic inequality and insecurity will never really get started. As George Gresham, the president of United Health Care Workers East wrote in The New York Times, ""By defunding unions and weakening union members via \'right to work\' laws, corporations and those that do their bidding remove workers\' primary means of raising wages, securing pensions'
 'stable succession plans; a united elite; institutions to bridge regional and ethnic divisions and assure fairness in political and economic access and a functioning economy with capabilities for providing employment and growth. Rather than working to secure these things, the U.S. administration has succumbed to the illusion that precision bombing or other surgical interventions to remove ""dangerous elements"" will sustain broader social and political stability. Anyone could see that the'
 ""away the power of public unions and signed a right to work law that barred unions from collecting dues from employees who weren't in unions. Unions are under assault, and the movement is looking for help. Democrats, and some Republicans, often talk about needing to deal with the problem of economic inequality. Much of the talk is often vague and offers little in the way to real solutions. Shoring up the strength of unions is one area where the government can help protect jobs for middle class""
 ""and wage stagnation, have played a big part in the story, too. Liberals are eager to talk about their favorite economic fixes for inequality: raising the minimum wage, bolstering unions and taxing the rich to pay for new social benefits for families of modest means. But they seem uncomfortable talking about marriage, which is seen as an unwelcome distraction from issues of economic power. It's tempting to blame such reticence on President George W. Bush's ill-fated Healthy Marriage Initiative,""
 'Ages? If we take no action, we\'re headed toward a kind of digital world feudalism where there are a handful of kings, a lot of peasants and no middle class. There\'s no easy fix, but we can do three things immediately. First, we can stop glorifying tech titans and start talking openly about Silicon Valley\'s questionable tactics and its real job creation record (i.e., just follow the numbers). Second, we can encourage more lawsuits against the abusive practices of ""sharing-economy"" powerhouses.'
 'reach and that does not exacerbate inequality or leave low-income and minority residents behind, communities will need to coordinate and collaborate as they plan and implement policy decisions that affect metropolitan development patterns.""'
 ""GOP presidential candidates are already trying to position themselves to steal the thunder of the Democratic nominee when it comes to issues of wage inequality and middle-class stagnation. But how exactly do they propose to reinvigorate a middle-class that is overwhelmingly composed of families with two wage-earners if they don't fight for women's workplace issues? For instance, child care may be thought of as a woman's issue, but it's really a family issue, virtually by definition, and an""]","The government can protect middle class jobs and address economic inequality and insecurity by strengthening unions, raising the minimum wage, and taxing the rich to fund social benefits for families of modest means. Additionally, addressing women's workplace issues, such as child care, is crucial for supporting middle-class families. These measures can help ensure fair wages, secure pensions, and overall economic stability.","Shoring up the strength of unions is one area where the government can help protect jobs for middle class Americans. Without strong unions, the battle against economic inequality and insecurity will never really get started.",0.3791800409243743,0.14285714285714285,0.9999999999999991,0.8178571428435119
Why was the Bardo Museum targeted in the terrorist attack and what is its significance in Tunis?,"['the prestigious Bardo Museum in central Tunis, the country\'s tourism industry is once again facing jeopardy even as authorities and operators scramble to ensure the safety of visitors currently in the country. A significant number of foreign tourists were inside the museum at the time of the attack, which government officials said was the work of ""Islamists."" Prime Minister Habib Essid said Polish, Italian, German and Spanish tourists are among those killed, with another 20 tourists plus two'
 ""(CNN)Wednesday's terrorist attack, which killed 23 people, hit Tunisia where it hurt by targeting its flourishing tourism industry. The deadly attack on the prominent Bardo Museum near Tunisia's parliament in the country's capital, Tunis, is the latest instance of an armed assault carried out by gunmen willing to fight to the death, a tactic that has been widely adopted by jihadist terrorists in recent years, including in North Africa. Such attacks mimic the 2008 Mumbai assaults in which 10""
 'the Bardo Museum. Protesters held banners that said ""We are not afraid"" and ""Je suis Bardo"" as they chanted ""Tunisia is free, and out with terrorism."" On March 18, the art, culture and history museum was the site of a drastically different scene, as gunmen opened fire on tourists in a siege that also forced the evacuation of the neighboring Parliament. ISIS claimed responsibility for the attack in an audio message posted online the next day. Hours before Sunday\'s demonstration began, Tunisia\'s'
 ""London (CNN)Tunisia's ultra-radical fringe has come back to bite a government born out of the most successful experiment in constitutional reform to emerge from the 2011 Arab Spring revolutions. Wednesday's attack on the Bardo Museum in Tunis was grimly predictable, coming from what the Tunisian Interior Ministry calls a violent ultra-radical Islamist fringe forced underground -- but not crushed -- by security services. Jihadist firebrands representing thousands of active militants at home and""
 ""(CNN)The attack on Tunisia's famed Bardo Museum is just the latest evidence that parts of North and sub-Saharan Africa have become a magnet for Islamist extremism. Tunisia -- lying just across the Mediterranean from Europe, but bordered on one side by Libya and on the other by Algeria -- has until now not suffered the kind of large-scale terror attacks seen in both those nations in recent years. But it has emerged as a place of increasing concern as the threat of Islamist extremism has""
 'around the targeted museum. Rescuers carried wounded tourists away on stretchers. Essid didn\'t specify where the attackers came from. Interior Ministry spokesman Mohamed Ali Aroui called them Islamists in remarks on national radio. The museum, housed in a 19th century palace, bills itself as ""a jewel of Tunisian heritage."" Its exhibits showcase Tunisian art, culture and history, and it boasts a collection of mosaics, including one of the poet Virgil, as well as marble sculptures, furniture,'
 ""said the attackers at the Bardo Museum had specifically targeted tourists to hurt the country's economy. This seems a likely outcome of the attack, as tourism is vital to Tunisia's economy, providing 15% of GDP. Tunisia is also the only country where the Arab Spring produced a successful, lasting democratic transition, making it attractive to tourists who are avoiding going to countries like Egypt, which did not weather the Arab Spring as well as Tunisia. Already, some tour companies are""]","The Bardo Museum was targeted in the terrorist attack because it is a prominent symbol of Tunisia's flourishing tourism industry and cultural heritage. The attack aimed to strike at the heart of Tunisia's economy and destabilize the country by targeting a site frequented by foreign tourists. The museum is significant in Tunis as it showcases Tunisian art, culture, and history, and is housed in a 19th-century palace, making it a jewel of Tunisian heritage.","The Bardo Museum was targeted in the terrorist attack because of its significance in Tunis. It is located next to Tunisia's Parliament and is considered a ""jewel of Tunisian heritage"". The museum showcases the country's art, culture, and history. Its prominent place in Tunisia's economy, which heavily relies on tourism, made it a logical target for terrorists.",0.6432382379141894,1.0,0.9580013460032161,0.9999999999857143
What is the impact of reversing Section 66A on freedom of speech in India and what are some examples of enforced cyber laws for online content?,"['(CNN)India\'s highest court has reversed a controversial law that gave the authorities sweeping powers to arrest and potentially jail people for comments posted on social networks and other Internet platforms. The Supreme Court ruled that Section 66A of the 2008 Information Technology Act was ""unconstitutional"" and ""hit at the root of liberty and freedom of expression, the two cardinal pillars of democracy."" Under Section 66A, alleged offenders could face up to three years in jail for posting'
 'democracy."" Under Section 66A, alleged offenders could face up to three years in jail for posting material that is ""grossly offensive,"" has ""menacing character,"" -- or perhaps even more ambiguously -- causes ""annoyance or inconvenience."" The court said this wording was ""vague"" and could be ""misconstrued,"" according to Ranjeeta Rohatgi, an advocate who was present at the hearing in Delhi Tuesday. India\'s cyber laws have ignited a furious debate about curbs on freedom of speech in recent years.'
 'a woman and sending offensive messages from a computer. Mahapatra called the charges a misuse of the law ""in the name of surveillance, to curb democratic rights, freedom of speech and human rights of common people."" A year earlier, Delhi went one step further with its digital crackdown when the so-called ""intermediary guidelines"" implicated web platforms themselves. The rules now require Internet companies to take down any content seen as ""disparaging,"" ""blasphemous,"" or ""defamatory"" within 36'
 ""India's cyber laws have ignited a furious debate about curbs on freedom of speech in recent years.  In 2012, a university professor was arrested for circulating a cartoon that poked fun at West Bengal Chief Minister Mamata Banerjee. The cartoon, which was a parody of a scene in a popular Indian movie, went viral on social media. He was charged with a range of offenses including defamation, insulting a woman and sending offensive messages from a computer. Mahapatra called the charges a misuse of""
 ""introducing a swath of regressive legislation and regulations in a further assault against online privacy and freedom of expression. A new, vaguely worded draft anti-terror law lacks sufficient safeguards and gives the authorities virtually a free rein to collect information on individuals' online activities. All Internet and telecommunication service providers operating in China would be required to give the government backdoor access to their systems and details about the encryption used.""]","Reversing Section 66A of the 2008 Information Technology Act positively impacts freedom of speech in India by removing the threat of arrest and imprisonment for posting ""grossly offensive"" or ""annoying"" content, which the Supreme Court deemed unconstitutional and vague. Examples of enforced cyber laws include the arrest of a university professor in 2012 for circulating a cartoon mocking a political figure and the requirement for Internet companies to remove content deemed ""disparaging,"" ""blasphemous,"" or ""defamatory"" within 36 hours. These laws have sparked significant debate about curbs on freedom of speech.","The reversal of Section 66A has a positive impact on freedom of speech in India as it was deemed unconstitutional and a violation of liberty and freedom of expression. This law gave authorities the power to arrest and jail individuals for posting comments on social networks and other internet platforms. It was criticized for its vague wording and potential for misuse. The reversal of this law signifies a step towards protecting democratic rights and freedom of speech. Some examples of enforced cyber laws for online content in India include the ""intermediary guidelines"" that require internet companies to take down content deemed disparaging, blasphemous, or defamatory within 36 hours of a user's request. In Mumbai, police blocked 650 posts and pages under these regulations, and Google and Facebook have also complied with orders to remove content issued by Indian courts, government agencies, and law enforcement.",0.6582331350557318,0.6,0.9337509356009308,0.999999999975
